[
  {
    "variable_name": "episode_id",
    "measure_family": "supporting",
    "track": "identity",
    "mathematical_definition": "H(protocol || chain_id || native_unit_id || actor_role)",
    "indexing": "i indexes a unique economic lifecycle; a indexes an actor when actor-specific",
    "observation_unit": "request or actor-episode",
    "measurement_unit": "identifier",
    "economic_definition": "Stable identifier for one economically coherent lifecycle.",
    "economic_mechanism": "Prevents repeated logs from being treated as independent economic choices.",
    "hypothesis_role": "All events belonging to one lifecycle map to one episode.",
    "source_mapping": "polygon_uma_request_rounds.oo_request_id; uma_dvm_requests.dvm_request_id",
    "decision_time_availability": "T0",
    "evidence_class": "derived",
    "missing_value_rule": "Never impute; an unresolvable native id excludes the row.",
    "validation_rule": "Unique inside protocol, chain and native unit; deterministic under reruns.",
    "references": "https://www.w3.org/TR/prov-o/; https://raw.githubusercontent.com/UMAprotocol/protocol/a16ee53125c433dfa4e29738b73d9069ff109c03/packages/core/contracts/optimistic-oracle-v2/implementation/OptimisticOracleV2.sol; https://github.com/UMAprotocol/uma-docs/blob/master/faqs.md",
    "measurement_limitations": "The same cross-chain lifecycle may have multiple native identifiers; link grade must be retained.",
    "uma_constructability": "complete",
    "uma_source_tables": "polygon_uma_request_rounds; uma_dvm_requests",
    "uma_non_null_observations": 46420,
    "notes": ""
  },
  {
    "variable_name": "decision_time_unix",
    "measure_family": "supporting",
    "track": "timing",
    "mathematical_definition": "t_i^d = block_timestamp(first decision event for i)",
    "indexing": "i=request or actor-episode",
    "observation_unit": "request or actor-episode",
    "measurement_unit": "Unix seconds",
    "economic_definition": "Time at which an economic actor must choose an action.",
    "economic_mechanism": "Defines the information set and prevents future leakage.",
    "hypothesis_role": "Only evidence with timestamp <= t_i^d may enter an agent decision.",
    "source_mapping": "polygon_oov2_events.block_time for RequestPrice/ProposePrice/DisputePrice",
    "decision_time_availability": "T0",
    "evidence_class": "event",
    "missing_value_rule": "Null if the native event has no block timestamp; never replace with settlement time.",
    "validation_rule": "Timestamp equals the canonical block timestamp for the cited transaction.",
    "references": "https://raw.githubusercontent.com/UMAprotocol/protocol/a16ee53125c433dfa4e29738b73d9069ff109c03/packages/core/contracts/optimistic-oracle-v2/implementation/OptimisticOracleV2.sol; https://github.com/UMAprotocol/uma-docs/blob/master/faqs.md",
    "measurement_limitations": "A request contains several decision times; the actor role must specify which one is used.",
    "uma_constructability": "complete",
    "uma_source_tables": "polygon_oov2_events",
    "uma_non_null_observations": 211026,
    "notes": ""
  },
  {
    "variable_name": "challenge_deadline_unix",
    "measure_family": "supporting",
    "track": "timing",
    "mathematical_definition": "d_i = expirationTime_i",
    "indexing": "i=OOV2 proposal",
    "observation_unit": "proposal",
    "measurement_unit": "Unix seconds",
    "economic_definition": "Last time at which the proposal can be disputed under the recorded request parameters.",
    "economic_mechanism": "Defines the monitoring window and the option value of waiting.",
    "hypothesis_role": "Longer windows may increase verification opportunity and capital lock.",
    "source_mapping": "polygon_uma_request_rounds.expiration_time from ProposePrice",
    "decision_time_availability": "T1",
    "evidence_class": "event",
    "missing_value_rule": "Null before proposal or when expirationTime is absent; not zero.",
    "validation_rule": "d_i >= proposal_time_i and matches the ProposePrice event payload.",
    "references": "https://raw.githubusercontent.com/UMAprotocol/protocol/a16ee53125c433dfa4e29738b73d9069ff109c03/packages/core/contracts/optimistic-oracle-v2/implementation/OptimisticOracleV2.sol; https://github.com/UMAprotocol/uma-docs/blob/master/faqs.md",
    "measurement_limitations": "Deadline is protocol time, not proof that any monitor observed the proposal.",
    "uma_constructability": "complete",
    "uma_source_tables": "polygon_uma_request_rounds; polygon_oov2_events",
    "uma_non_null_observations": 41827,
    "notes": ""
  },
  {
    "variable_name": "bond_raw",
    "measure_family": "B",
    "track": "capital",
    "mathematical_definition": "B_i = effectiveBond_i",
    "indexing": "i=OOV2 proposal/dispute",
    "observation_unit": "request",
    "measurement_unit": "raw token integer",
    "economic_definition": "Principal placed at risk by the proposal and, when challenged, the dispute.",
    "economic_mechanism": "Risk-bearing commitment and the private cost of an incorrect claim.",
    "hypothesis_role": "Higher B_i may deter frivolous proposals/challenges but raises entry and capital costs.",
    "source_mapping": "polygon_uma_request_rounds.effective_bond_raw; currency supplies the asset",
    "decision_time_availability": "T1",
    "evidence_class": "event",
    "missing_value_rule": "Null when no proposal exists; a source value of 0 is verified zero.",
    "validation_rule": "Integer string; positive for proposed requests; reconcile with token transfers.",
    "references": "https://raw.githubusercontent.com/UMAprotocol/protocol/a16ee53125c433dfa4e29738b73d9069ff109c03/packages/core/contracts/optimistic-oracle-v2/implementation/OptimisticOracleV2.sol; https://github.com/UMAprotocol/uma-docs/blob/master/faqs.md; https://doi.org/10.1016/0022-0531(79)90031-0",
    "measurement_limitations": "Request-level bond does not alone identify each actor's duration of exposure.",
    "uma_constructability": "complete",
    "uma_source_tables": "polygon_uma_request_rounds; polygon_uma_token_flows",
    "uma_non_null_observations": 41826,
    "notes": ""
  },
  {
    "variable_name": "reward_configured_raw",
    "measure_family": "B",
    "track": "incentive",
    "mathematical_definition": "R_i^cfg = request.reward_i",
    "indexing": "i=OOV2 request",
    "observation_unit": "request",
    "measurement_unit": "raw token integer",
    "economic_definition": "Reward offered by the requester before a report is supplied.",
    "economic_mechanism": "Ex-ante incentive for costly information production/reporting.",
    "hypothesis_role": "A larger configured reward may attract participation but is not yet realized income.",
    "source_mapping": "polygon_uma_request_rounds.question_reward_raw (cross-check reward_raw)",
    "decision_time_availability": "T0",
    "evidence_class": "contract_parameter",
    "missing_value_rule": "Null means the request parameter was not recovered; zero is a valid no-reward request.",
    "validation_rule": "question_reward_raw = reward_raw where both are populated.",
    "references": "https://raw.githubusercontent.com/UMAprotocol/protocol/a16ee53125c433dfa4e29738b73d9069ff109c03/packages/core/contracts/optimistic-oracle-v2/implementation/OptimisticOracleV2.sol; https://github.com/UMAprotocol/uma-docs/blob/master/faqs.md; https://doi.org/10.2307/3003320; https://doi.org/10.1287/moor.6.1.58",
    "measurement_limitations": "Configured reward may later be refunded or rolled and must not be labelled paid.",
    "uma_constructability": "complete",
    "uma_source_tables": "polygon_uma_request_rounds",
    "uma_non_null_observations": 42675,
    "notes": ""
  },
  {
    "variable_name": "reward_to_bond_ratio",
    "measure_family": "B",
    "track": "incentive",
    "mathematical_definition": "rho_i = R_i^cfg / B_i for B_i > 0",
    "indexing": "i=OOV2 proposed request",
    "observation_unit": "request",
    "measurement_unit": "dimensionless ratio",
    "economic_definition": "Configured compensation relative to capital placed at risk.",
    "economic_mechanism": "Incentive intensity and risk-return trade-off.",
    "hypothesis_role": "Higher rho_i may affect proposal or dispute participation conditional on observable selection.",
    "source_mapping": "question_reward_raw / effective_bond_raw within the same asset and decimals",
    "decision_time_availability": "T1",
    "evidence_class": "derived",
    "missing_value_rule": "Null when B_i is null or zero; never divide by zero or combine assets.",
    "validation_rule": "Both inputs share currency; ratio is nonnegative and recomputable from raw integers.",
    "references": "https://raw.githubusercontent.com/UMAprotocol/protocol/a16ee53125c433dfa4e29738b73d9069ff109c03/packages/core/contracts/optimistic-oracle-v2/implementation/OptimisticOracleV2.sol; https://github.com/UMAprotocol/uma-docs/blob/master/faqs.md; https://doi.org/10.2307/3003320; https://doi.org/10.1287/moor.6.1.58",
    "measurement_limitations": "Not a causal incentive estimate; request composition and adapter versions confound comparisons.",
    "uma_constructability": "complete",
    "uma_source_tables": "polygon_uma_request_rounds",
    "uma_non_null_observations": 41826,
    "notes": ""
  },
  {
    "variable_name": "dispute_decision",
    "measure_family": "C",
    "track": "monitoring",
    "mathematical_definition": "D_i = 1[DisputePrice event observed before d_i]",
    "indexing": "i=OOV2 proposal",
    "observation_unit": "request",
    "measurement_unit": "binary",
    "economic_definition": "Whether at least one actor paid the on-chain cost to challenge the proposal.",
    "economic_mechanism": "Costly monitoring and public-good provision.",
    "hypothesis_role": "Low dispute rates may reflect agreement, weak monitoring, or high challenge cost; they do not prove truth.",